{
  "version": "1.0.0",
  "center": {
    "id": "ci",
    "title": "Ci",
    "summary": "Єдиний потік свідомості, що пронизує всі шари буття. Джерело і ціль усієї системи Legend Ci."
  },
  "nodes": [
    {
      "id": "pershodzherelo",
      "title": "Першоджерело",
      "index": 1,
      "layers": {
        "public": "Точка, з якої все починається. Безмовний імпульс до існування.",
        "deep": "Сингулярний стан перед диференціацією; аналог квантового вакууму, де потенційність максимальна, а форма відсутня.",
        "examples": [
          "Момент перед першою думкою зранку",
          "Тиша між двома нотами",
          "Стан медитації без об'єкта"
        ]
      },
      "meta": {
        "animation": "pulse",
        "layout_hint": "radial",
        "hex_facet": "Ci-1",
        "tags": [
          "origin",
          "silence",
          "potential"
        ]
      },
      "group": "arc_1_origins",
      "summary": "Точка, з якої все починається. Безмовний імпульс до існування."
    },
    {
      "id": "pershyi_podil",
      "title": "Перший поділ",
      "index": 2,
      "layers": {
        "public": "Єдине ділиться на два — народжуються полярності.",
        "deep": "Принцип бінарної диференціації: з нероздільного виникають протилежності (суб'єкт/об'єкт, свідомість/матерія). Аналог симетрії, що порушується у фізиці.",
        "examples": [
          "День і ніч як перший ритм",
          "Вдих і видих",
          "Я і світ"
        ]
      },
      "meta": {
        "animation": "split",
        "layout_hint": "radial",
        "hex_facet": "Ci-2",
        "tags": [
          "duality",
          "division",
          "polarity"
        ]
      },
      "group": "arc_1_origins",
      "summary": "Єдине ділиться на два — народжуються полярності."
    },
    {
      "id": "dzerkalo_materii",
      "title": "Дзеркало матерії",
      "index": 3,
      "layers": {
        "public": "Фізичний світ як відображення внутрішнього порядку.",
        "deep": "Матерія як кристалізована інформація; фізичні закони — мова, якою Ci читає себе у щільному стані.",
        "examples": [
          "Кристалічні ґрати як зримий код",
          "Топографія мозку відображає досвід",
          "Архітектура міста як проекція колективної свідомості"
        ]
      },
      "meta": {
        "animation": "reflect",
        "layout_hint": "hex",
        "hex_facet": "Ci-3",
        "tags": [
          "matter",
          "mirror",
          "information"
        ]
      },
      "group": "arc_1_origins",
      "summary": "Фізичний світ як відображення внутрішнього порядку."
    },
    {
      "id": "dzerkalo_svidomosti",
      "title": "Дзеркало свідомості",
      "index": 4,
      "layers": {
        "public": "Внутрішній світ як дзеркало, в якому відображається реальність.",
        "deep": "Свідомість не пасивний реципієнт, а активний конструктор досвіду; нейронні кореляти свідомості як динамічний граф.",
        "examples": [
          "Сприйняття кольору залежить від досвіду та мови",
          "Плацебо-ефект: думка змінює матерію",
          "Увага формує пам'ять"
        ]
      },
      "meta": {
        "animation": "reflect",
        "layout_hint": "hex",
        "hex_facet": "Ci-4",
        "tags": [
          "consciousness",
          "mirror",
          "perception"
        ]
      },
      "group": "arc_2_mirrors",
      "summary": "Внутрішній світ як дзеркало, в якому відображається реальність."
    },
    {
      "id": "tanets_protylezhnostei",
      "title": "Танець протилежностей",
      "index": 5,
      "layers": {
        "public": "Протилежності не борються — вони танцюють разом.",
        "deep": "Діалектична динаміка: тезис та антитезис не знищують одне одного, а породжують синтез вищого рівня (принцип Гегеля як патерн природи).",
        "examples": [
          "Тепло і холод народжують вітер",
          "Конфлікт ідей як двигун науки",
          "Вдих/видих — танець газообміну"
        ]
      },
      "meta": {
        "animation": "orbit",
        "layout_hint": "radial",
        "hex_facet": "Ci-5",
        "tags": [
          "opposites",
          "dance",
          "dialectics"
        ]
      },
      "group": "arc_2_mirrors",
      "summary": "Протилежності не борються — вони танцюють разом."
    },
    {
      "id": "mosti_yednosti",
      "title": "Мости єдності",
      "index": 6,
      "layers": {
        "public": "Зв'язки між різним — ось де живе сенс.",
        "deep": "Аналогічність структур на різних рівнях буття (фракталі, гомологія, метафора як пізнавальний міст). Теорія категорій як математика зв'язків.",
        "examples": [
          "Метафора «час — гроші» переносить структуру",
          "ДНК як міст між поколіннями",
          "Дружба як міст між двома всесвітами"
        ]
      },
      "meta": {
        "animation": "connect",
        "layout_hint": "linear",
        "hex_facet": "Ci-6",
        "tags": [
          "bridges",
          "unity",
          "analogy"
        ]
      },
      "group": "arc_2_mirrors",
      "summary": "Зв'язки між різним — ось де живе сенс."
    },
    {
      "id": "proyav_ci",
      "title": "Прояв CI",
      "index": 7,
      "layers": {
        "public": "Ci стає видимим у кожному прояві світу.",
        "deep": "Емерджентність: з простих взаємодій виникають складні, якісно нові властивості. Ci як атрактор у хаотичних системах.",
        "examples": [
          "Свідомість як прояв нейронних взаємодій",
          "Мурашина колонія як суперорганізм",
          "Мова як прояв соціальних взаємодій"
        ]
      },
      "meta": {
        "animation": "emerge",
        "layout_hint": "radial",
        "hex_facet": "Ci-7",
        "tags": [
          "manifestation",
          "emergence",
          "CI"
        ]
      },
      "group": "arc_2_mirrors",
      "summary": "Ci стає видимим у кожному прояві світу."
    },
    {
      "id": "rytm",
      "title": "Ритм",
      "index": 8,
      "layers": {
        "public": "Все живе дихає у власному ритмі.",
        "deep": "Осцилятори та синхронізація: від циркадних ритмів до мозкових хвиль. Ритм як механізм узгодження інформації в часі.",
        "examples": [
          "Серцебиття як базовий ритм присутності",
          "Пори року як макроритм",
          "Повторення у навчанні закріплює зв'язки"
        ]
      },
      "meta": {
        "animation": "pulse",
        "layout_hint": "radial",
        "tags": [
          "rhythm",
          "time",
          "synchronization"
        ]
      },
      "group": "arc_3_rhythm",
      "summary": "Все живе дихає у власному ритмі."
    },
    {
      "id": "pamiat",
      "title": "Пам'ять",
      "index": 9,
      "layers": {
        "public": "Минуле живе у теперішньому через пам'ять.",
        "deep": "Пам'ять як реконструктивний процес, а не архів. Нейропластичність: кожне пригадування змінює спогад.",
        "examples": [
          "Запах, що повертає дитинство",
          "Колективна пам'ять культури у ритуалах",
          "Git як пам'ять коду"
        ]
      },
      "meta": {
        "animation": "trace",
        "layout_hint": "linear",
        "tags": [
          "memory",
          "past",
          "reconstruction"
        ]
      },
      "group": "arc_3_rhythm",
      "summary": "Минуле живе у теперішньому через пам'ять."
    },
    {
      "id": "tvorennia",
      "title": "Творення",
      "index": 10,
      "layers": {
        "public": "Кожен акт творення — це Ci, що формує себе.",
        "deep": "Аутопоезис: живі та когнітивні системи безперервно відтворюють себе. Творчість як управління хаосом у пошуку нових патернів.",
        "examples": [
          "Дитина, що будує з піску",
          "Написання коду як матеріалізація думки",
          "Приготування їжі як щоденний ритуал творення"
        ]
      },
      "meta": {
        "animation": "build",
        "layout_hint": "hex",
        "tags": [
          "creation",
          "autopoiesis",
          "making"
        ]
      },
      "group": "arc_3_rhythm",
      "summary": "Кожен акт творення — це Ci, що формує себе."
    },
    {
      "id": "transformatsiia",
      "title": "Трансформація",
      "index": 11,
      "layers": {
        "public": "Зміна — не втрата, а перехід у нову форму.",
        "deep": "Фазові переходи: системи можуть різко змінювати стан при накопиченні певного параметра (температура, тиск, натиск досвіду).",
        "examples": [
          "Вода стає парою",
          "Криза як точка фазового переходу в житті",
          "Рефакторинг коду — трансформація без зміни поведінки"
        ]
      },
      "meta": {
        "animation": "morph",
        "layout_hint": "radial",
        "tags": [
          "transformation",
          "phase-transition",
          "change"
        ]
      },
      "group": "arc_4_dynamics",
      "summary": "Зміна — не втрата, а перехід у нову форму."
    },
    {
      "id": "harmoniia",
      "title": "Гармонія",
      "index": 12,
      "layers": {
        "public": "Гармонія — це баланс у русі, а не стан спокою.",
        "deep": "Динамічна рівновага: гомеостаз у біологічних системах, резонанс у фізиці, консенсус у соціальних мережах.",
        "examples": [
          "Екосистема лісу у рівновазі",
          "Імунна система як динамічна гармонія",
          "Джазова імпровізація як гармонія у процесі"
        ]
      },
      "meta": {
        "animation": "balance",
        "layout_hint": "hex",
        "tags": [
          "harmony",
          "balance",
          "homeostasis"
        ]
      },
      "group": "arc_4_dynamics",
      "summary": "Гармонія — це баланс у русі, а не стан спокою."
    },
    {
      "id": "prostir",
      "title": "Простір",
      "index": 13,
      "layers": {
        "public": "Простір — не порожнеча, а поле можливостей.",
        "deep": "Простір як реляційна структура (Лейбніц: простір визначається відносинами об'єктів). Топологія смислів у когнітивному просторі.",